{
  "$schema": "../../schemas/dataflow.schema.json",
  "version": 1,
  "job": "oofem",
  "title": "OOFEM simulation eval",
  "summary": "Can a model write a Python script against the OOFEM bindings that reproduces a paper's curves? There is no spec to compare: the script runs, and the curves it writes are scored against the paper's digitized data. The default one-shot arm gets one call with no repair loop. The agent arm (--agent) can read the OOFEM source, try things in a sandbox and validate its script before submitting.",
  "command": "worker/worker.sh oofem",
  "flag_sources": [
    "worker/jobs/oofem/run_oofem.py",
    "worker/jobs/oofem/job.sh"
  ],

  "groups": [
    {"id": "per_call", "label": "for each model × case"},
    {"id": "oneshot", "label": "one-shot arm (default)", "parent": "per_call", "enabled_by": "!--agent",
     "detail": "Used when --agent is not given. One call, no feedback of any kind: the script runs once as written."},
    {"id": "agent", "label": "agent arm", "parent": "per_call", "enabled_by": "--agent",
     "detail": "A tool loop that runs until the model submits a validated script or a budget runs out. The full transcript is kept, so every step can be audited."},
    {"id": "tools", "label": "agent tools", "parent": "agent", "enabled_by": "--agent",
     "detail": "Reads are confined to the OOFEM tree and the workdir; writes to the workdir."}
  ],

  "nodes": [
    {"id": "dataset", "kind": "input", "label": "Dataset",
     "path": "dataset/manifest.json",
     "code": "worker/tools/build_dataset.py",
     "detail": "Paper text, paper PDF and scope.md per case. Built automatically if missing."},
    {"id": "refs", "kind": "input", "label": "Reference curves",
     "path": "benchmarks/<case>/reference/*.csv, curves.json",
     "code": "worker/jobs/oofem/curves.py",
     "detail": "The (file, column) curves a case must reproduce. The prompt and the scorer use the same list, so they cannot drift apart. Cases without reference curves are skipped before any call."},
    {"id": "oofem_src", "kind": "input", "label": "OOFEM source + API",
     "path": "$OOFEM_ROOT, worker/jobs/oofem/prompts/oofem_api.md",
     "detail": "The bindings' API list and example scripts. The agent arm can also read the C++ source, where the input keywords are defined."},
    {"id": "models", "kind": "input", "label": "Model roster",
     "path": "worker/models.yaml",
     "detail": "Model ids, token limits, timeouts, prices, and whether a model accepts images."},
    {"id": "oofem_check", "kind": "check", "label": "oofempy importable",
     "code": "worker/jobs/oofem/run_oofem.py:check_oofem",
     "detail": "OOFEM_PY can import the compiled bindings. Checked before any call; skipped by --dry-run."},

    {"id": "os_prompt", "kind": "step", "label": "Build prompt", "group": "oneshot",
     "code": "worker/jobs/oofem/run_oofem.py:build_prompt",
     "detail": "Scope, paper text (cut at --max-paper-chars), the curve contract (ids, x ranges, units), the API list and examples, and the time limit the script must fit."},
    {"id": "os_llm", "kind": "llm", "label": "Write script", "group": "oneshot",
     "path": "<run>/<model>/<case>/raw.json",
     "detail": "One chat completion. The reply must contain the whole script."},
    {"id": "extract", "kind": "check", "label": "Extract Python", "group": "oneshot",
     "code": "worker/jobs/oofem/run_oofem.py:extract_python",
     "detail": "The first fenced block that parses as Python becomes candidate.py. Otherwise the outcome is unparseable and nothing runs."},
    {"id": "gate", "kind": "check", "label": "Static gate", "group": "oneshot",
     "code": "worker/jobs/oofem/run_oofem.py:static_gate",
     "detail": "Refuses scripts that import subprocess, socket, urllib and similar, or that never import oofempy. Outcome rejected."},
    {"id": "execute", "kind": "solver", "label": "Run script", "group": "oneshot",
     "path": "<run>/<model>/<case>/run.log",
     "code": "worker/jobs/oofem/run_oofem.py:execute",
     "detail": "Runs candidate.py with OOFEM_PY in a fresh work/ directory that holds the reference CSVs. Outcomes: crashed (with the signal, e.g. SIGSEGV inside oofem), timeout, or no results.csv."},

    {"id": "ag_setup", "kind": "step", "label": "System prompt + workdir", "group": "agent",
     "code": "worker/jobs/oofem/run_oofem.py:build_agent_system",
     "detail": "A small fixed system prompt: scope, curve contract, API list, turn budget. The paper goes into work/ as paper.txt and paper.pdf, not into the prompt, so forty turns don't repeat 400k characters."},
    {"id": "ag_llm", "kind": "llm", "label": "Agent turn", "group": "agent",
     "path": "<run>/<model>/<case>/transcript.jsonl",
     "code": "worker/jobs/oofem/agent.py:run_agent",
     "detail": "One completion per turn with tool calls. Token use is added up across turns and reported next to the score, along with the cost when models.yaml has a price."},
    {"id": "pressure", "kind": "check", "label": "Turn budget + nudges", "group": "agent",
     "code": "worker/jobs/oofem/agent.py:run_agent",
     "detail": "A first candidate.py is due after a third of --max-turns, insisted on at half. After --max-turns, --finalization-turns remain for repair, validation and submit only. The loop stops on submit, when the budget runs out, after more than 3 turns in a row without a tool call, on degenerate repeated output, or on an API error that persists through --api-retries."},

    {"id": "t_explore", "kind": "tool", "label": "Read OOFEM source", "group": "tools",
     "detail": "list_dir, read_file, grep, inspect_oofem."},
    {"id": "t_paper", "kind": "tool", "label": "Read paper", "group": "tools",
     "detail": "read_paper_page for text. view_paper_page renders the page as an image, only for models marked vision."},
    {"id": "t_spike", "kind": "tool", "label": "run_python", "group": "tools",
     "detail": "Short experiments against the bindings, each capped by --spike-timeout."},
    {"id": "t_write", "kind": "tool", "label": "write_file", "group": "tools",
     "detail": "Writes candidate.py (or scratch files). Writing candidate.py marks it as not validated."},
    {"id": "t_validate", "kind": "solver", "label": "run_candidate", "group": "tools",
     "code": "worker/jobs/oofem/agent.py:run_candidate",
     "detail": "Runs candidate.py from a clean staging directory, so leftovers from a spike can't help it pass, and checks that results.csv holds the contract's curve ids. Capped by --run-timeout."},
    {"id": "t_submit", "kind": "check", "label": "submit", "group": "tools",
     "detail": "Accepted only if this exact candidate.py passed run_candidate. An edit after that makes the submission invalid again."},

    {"id": "work_out", "kind": "artifact", "label": "results.csv + plot", "group": "per_call",
     "path": "<run>/<model>/<case>/work/results.csv, plot.png",
     "detail": "Long format, curve,x,y, because the curves of one case can have different x axes. The script must also plot its result over the reference."},
    {"id": "score", "kind": "step", "label": "Score curves", "group": "per_call",
     "path": "<run>/<model>/<case>/score.json, score.txt",
     "code": "worker/jobs/oofem/score.py",
     "detail": "The simulation is interpolated onto the reference x samples. score = coverage × max(0, 1 − nrmse). A missing curve scores 0; extra curves don't count."},
    {"id": "run_json", "kind": "artifact", "label": "run.json",
     "path": "<run>/run.json",
     "detail": "Per call: mode, outcome, curve scores, turns, tokens, cost, and whether the final script really used oofempy (solver_evidence)."}
  ],

  "edges": [
    {"from": "dataset", "to": "os_prompt", "carries": "paper text + scope"},
    {"from": "refs", "to": "os_prompt", "carries": "curve contract"},
    {"from": "oofem_src", "to": "os_prompt", "carries": "API list + examples"},
    {"from": "os_prompt", "to": "os_llm"},
    {"from": "models", "to": "os_llm", "kind": "control", "label": "model settings"},
    {"from": "os_llm", "to": "extract", "carries": "reply text"},
    {"from": "extract", "to": "gate", "when": "a block parses as Python"},
    {"from": "gate", "to": "execute", "when": "no banned import, imports oofempy"},
    {"from": "oofem_check", "to": "execute", "kind": "control"},
    {"from": "refs", "to": "execute", "carries": "reference/ copied into work/ for the overlay plot"},
    {"from": "execute", "to": "work_out", "when": "exit 0 and results.csv written"},

    {"from": "dataset", "to": "ag_setup", "carries": "paper.txt, paper.pdf, scope.md"},
    {"from": "refs", "to": "ag_setup", "carries": "curve contract + reference/"},
    {"from": "ag_setup", "to": "ag_llm"},
    {"from": "models", "to": "ag_llm", "kind": "control", "label": "model settings"},
    {"from": "pressure", "to": "ag_llm", "kind": "control", "label": "nudges + stop",
     "carries": "'candidate.py is due now', 'finalization only: N turns remain', and the stop decision",
     "limit": {"flag": "--max-turns"}},
    {"from": "ag_llm", "to": "t_explore", "kind": "tool"},
    {"from": "oofem_src", "to": "t_explore"},
    {"from": "ag_llm", "to": "t_paper", "kind": "tool"},
    {"from": "ag_llm", "to": "t_spike", "kind": "tool"},
    {"from": "ag_llm", "to": "t_write", "kind": "tool"},
    {"from": "ag_llm", "to": "t_validate", "kind": "tool",
     "carries": "exit status, run time, missing curve ids, the tail of the output"},
    {"from": "ag_llm", "to": "t_submit", "kind": "tool"},
    {"from": "oofem_check", "to": "t_validate", "kind": "control"},
    {"from": "t_validate", "to": "work_out", "when": "validation passed", "carries": "only the contract outputs, copied back"},
    {"from": "t_submit", "to": "score", "kind": "control", "when": "accepted and still validated"},

    {"from": "work_out", "to": "score"},
    {"from": "refs", "to": "score", "label": "reference data"},
    {"from": "score", "to": "run_json"}
  ],

  "params": [